{
  "schemaVersion": 1,
  "revision": 8,
  "datePolicy": "device-local",
  "validThrough": "2026-12-31",
  "windows": [
    {
      "from": "0001-01-01",
      "through": "2026-12-31",
      "edition": "local-v6",
      "minBuild": {
        "ios": 13,
        "android": 13
      }
    }
  ],
  "updates": {
    "ios": {
      "url": "https://testflight.apple.com/join/CCCawA1Q"
    },
    "android": {
      "url": null
    }
  },
  "selections": [
    {
      "from": "0001-01-01",
      "through": "2026-12-31",
      "edition": "daily-mix-v2",
      "minBuild": {
        "ios": 13,
        "android": 13
      }
    }
  ]
}
